{
  "label": "Günün kelimesi",
  "word": "Meticulous",
  "ipa": "/məˈtɪk.jə.ləs/",
  "pos": "adjective",
  "meaning_tr": "Titiz, en küçük ayrıntıya bile dikkat eden",
  "example": "She is meticulous about her IELTS essay planning.",
  "example_tr": "IELTS essay planlaması konusunda çok titizdir.",
  "synonyms": ["careful", "thorough", "precise"],
  "cta": "Kaydet 🔖 ve yarın bir cümlede kullan",
  "meta": {
    "topic": "meticulous",
    "caption": "Günün kelimesi: METICULOUS 📌\n\n/məˈtɪk.jə.ləs/ — titiz, ayrıntıcı\n\"She is meticulous about her essay planning.\"\n\nBand 7+ için \"careful\" yerine \"meticulous\" kullan. Examiner bunu fark eder 👀\n\nBu kelimeyle bir cümle yaz, yorumlara bırak 👇\nKaydet, sınavdan önce tekrar bak 🔖\n\nWord of the day: meticulous = extremely careful about details.",
    "hashtags": ["#ingilizce", "#günün_kelimesi", "#ahkakademi", "#ielts", "#vocabulary", "#wordoftheday", "#learnenglish", "#ingilizcekelime", "#ieltsvocabulary", "#toefl", "#englishwords"],
    "audio_mood": "calm lo-fi beat, typewriter clicks, soft chime at the end"
  }
}
